{
  "id": "clip-path-reveal",
  "name": "Clip-Path Geometric Reveal",
  "category": "chart_reveal",
  "visual_intent": "Progressively discloses mathematical curves, loss graphs, or geometric structures from left to right matching narration pace.",
  "status": "approved",
  "library_dependencies": [
    "gsap",
    "svg-native"
  ],
  "rendering_engine": "svg_dom",
  "tags": [
    "chart",
    "reveal",
    "clip-path",
    "graph",
    "curve",
    "loss"
  ],
  "performance_characteristics": {
    "cpu_intensity": "low",
    "gpu_intensity": "low",
    "dom_node_count": "1 clipPath rect, 1 path",
    "memory_profile": "Negligible (<15MB)"
  },
  "recipes": [
    "metric-curve-draw"
  ],
  "implementation_summary": "Tweens the width attribute of a clipping rectangle inside an SVG clipPath definition.",
  "metadata": {
    "author": "MotionLab",
    "created_at": "2026-10-30",
    "updated_at": "2026-10-30"
  }
}

