{
  "id": "glow-pulse",
  "name": "Active Entity Glow Pulse",
  "category": "lighting_atmosphere",
  "visual_intent": "Draws viewer focus to active computational entities, leader nodes, or focused terms via synchronized luminous breathing.",
  "status": "approved",
  "library_dependencies": [
    "gsap",
    "svg-native"
  ],
  "rendering_engine": "svg_dom",
  "tags": [
    "glow",
    "pulse",
    "highlight",
    "attention",
    "leader",
    "filter"
  ],
  "performance_characteristics": {
    "cpu_intensity": "low",
    "gpu_intensity": "medium",
    "dom_node_count": "1-3 SVG elements",
    "memory_profile": "Low (<25MB)"
  },
  "recipes": [
    "active-entity-glow"
  ],
  "implementation_summary": "Tweens CSS filter drop-shadow, box-shadow, or SVG feDropShadow with yoyo easing.",
  "metadata": {
    "author": "MotionLab",
    "created_at": "2026-10-30",
    "updated_at": "2026-10-30"
  }
}

